#,Categorie,Secteur,Ville,Nom,Adresse,Telephone,Email,Site?,Email?,Note,Nb Avis,Gamme Prix,Services,Nb Photos,Horaires,Editorial,Types Google,URL Maps,Citation Neg,Points Forts,Probleme,Accroche Email,Statut,1er contact,Relance 1,Relance 2,Relance 3,RDV,Call booke,Notes
209,Artisan,Menuisier,Rennes,Blanchard menuiserie service,"25 Rue de la Russelee, 35510 Cesson-Sévigné, France",06 18 45 29 66,,NON,NON,4.6,18,,,10,lundi: 08:00 – 19:30 | mardi: 08:00 – 20:30 | mercredi: 08:00 – 19:30 | jeudi: 08:00 – 19:30 | vendredi: 08:00 – 19:30 | samedi: Fermé | dimanche: Fermé,,,https://maps.google.com/?cid=12338268559033937405,"J'en suis même malheureux de devoir mettre une étoile car je en peux pas en mettre zéro. Cette menuiserie, c'est un vrai sketch.Ce professionnel est incompétent. début 2024 je contacte l'entreprise po","professionnel, reactif, ponctuel",impossible de reserver ou prendre rendez-vous en ligne,"Un de vos clients sur Google signale que c'est impossible de reserver ou prendre rendez-vous en ligne. Un d'eux a meme ecrit : ""RDV pris plusieurs semaines après pour prise de gabarits"" C'est frustrant, surtout le soir ou le week-end quand vous etes ferme. La solution : un systeme de reservation en ligne qui fonctionne meme quand vous dormez.",A contacter,,,,,,,
210,Artisan,Carreleur,Rennes,La Renov'Rennaise - Carreleur Rennes,"5 Rue du Manoir de Servigné, 35000 Rennes, France",06 58 64 24 83,,NON,NON,4.6,11,,,10,lundi: 08:30 – 17:30 | mardi: 08:30 – 17:30 | mercredi: 08:30 – 17:30 | jeudi: 08:30 – 17:30 | vendredi: 08:30 – 17:30 | samedi: Fermé | dimanche: Fermé,,general_contractor,https://maps.google.com/?cid=6551818346681149015,"Un gros manque de professionnalisme et d'honnêteté !

Nous avons commandé une plaque de carrelage (3,20 m x 1,60 m) à Rennes, pour un montant HT de 1058,52 € (hors pose). Voici les points clés de notr","conseil, propre, sympathique",impossible de reserver ou prendre rendez-vous en ligne,"Un de vos clients sur Google signale que c'est impossible de reserver ou prendre rendez-vous en ligne. Un d'eux a meme ecrit : ""(Le rendez-vous est prévu un vendredi)"" C'est frustrant, surtout le soir ou le week-end quand vous etes ferme. La solution : un systeme de reservation en ligne qui fonctionne meme quand vous dormez.",A contacter,,,,,,,
211,Artisan,Macon,Rennes,ERC 38,"12 Sq. de Galicie, 35200 Rennes, France",06 13 52 29 34,,NON,NON,4.4,7,,,2,lundi: 08:30 – 19:30 | mardi: 08:30 – 19:30 | mercredi: 08:30 – 19:30 | jeudi: 08:30 – 19:30 | vendredi: 08:30 – 19:30 | samedi: 08:30 – 12:00 | dimanche: Fermé,,general_contractor,https://maps.google.com/?cid=3286704167161224192,,,peu d'avis Google,"Vous n'avez que 5 avis sur Google. Vos concurrents en ont souvent 10x plus. Sans site web, vous etes invisible pour les gens qui cherchent votre activite.",A contacter,,,,,,,
212,Artisan,Macon,Rennes,AKBAL Construction,"Sq. de Galicie, 35200 Rennes, France",06 08 34 58 52,,NON,NON,4.2,5,,,0,lundi: 08:00 – 19:00 | mardi: 08:00 – 19:00 | mercredi: 08:00 – 19:00 | jeudi: 08:00 – 19:00 | vendredi: 08:00 – 19:00 | samedi: 08:00 – 18:00 | dimanche: Fermé,,general_contractor,https://maps.google.com/?cid=894419464554957584,"Nous avons fait construire notre maison par un constructeur qui les avait choisi...

En faisant faire des travaux dans notre vide sanitaire. Nous avons vu que cette societé avait fait du mauvais trava","professionnel, qualite, serieux",les clients ne peuvent pas voir vos realisations avant de vous choisir,"Un de vos clients sur Google signale que c'est les clients ne peuvent pas voir vos realisations avant de vous choisir. Un d'eux a meme ecrit : ""Je vais devoir le faire consigner par un huisser qui me permettra de le signaler rapidement au garant afin que ce problème soit in"" C'est frustrant, ce qui vous fait perdre des clients face a des concurrents mieux visibles. La solution : une galerie photo de vos meilleurs travaux.",A contacter,,,,,,,
213,Commerce,Fleuriste,Rennes,Saint Germain des Fleurs,"4 Pl. Saint-Germain, 35000 Rennes, France",07 84 87 20 23,,NON,NON,4.6,65,,,10,lundi: Fermé | mardi: 10:00 – 19:00 | mercredi: 10:00 – 19:00 | jeudi: 10:00 – 19:00 | vendredi: 10:00 – 19:00 | samedi: 09:00 – 19:00 | dimanche: 10:00 – 13:00,,"florist, store",https://maps.google.com/?cid=4521405336389970991,,"accueil, efficace, conseil",peu d'avis Google,"Vous n'avez que 5 avis sur Google. Vos concurrents en ont souvent 10x plus. Sans site web, vous etes invisible pour les gens qui cherchent votre activite.",A contacter,,,,,,,
214,Commerce,Epicerie,Rennes,Orient Express,"24 Rue du Pré Botté, 35000 Rennes, France",07 86 99 20 90,,NON,NON,3.5,19,,,10,lundi: 12:00 – 21:00 | mardi: 12:00 – 21:00 | mercredi: 12:00 – 21:00 | jeudi: 12:00 – 21:00 | vendredi: 12:00 – 21:00 | samedi: 12:00 – 21:00 | dimanche: 12:00 – 21:00,,"grocery_or_supermarket, store",https://maps.google.com/?cid=13357797620314686843,Le service est arrogant il me crie dessus sans raison j’ai acheté des écouteurs filaires qui en marchait pas bien je suis revenu au près de lui pour lui faire pas de mon désagrément il m’as dis que c  | Je suis aller avec ma fille pour un problème d’écouteurs les vendeurs nous on crié dessus limite insulter de naïf alors que c’est lui qui nous a proposé son produit il a porté les écouteurs apres nous,,peu d'avis Google,"Vous n'avez que 5 avis sur Google. Vos concurrents en ont souvent 10x plus. Sans site web, vous etes invisible pour les gens qui cherchent votre activite.",A contacter,,,,,,,
215,Commerce,Epicerie,Rennes,Alimentation Nine To Eleven,"71 Bd de la Tour d'Auvergne, 35000 Rennes, France",07 78 12 83 50,,NON,NON,3.3,14,,,4,"lundi: 13:30 – 00:00 | mardi: 00:00 – 13:00, 17:00 – 23:30 | mercredi: 17:00 – 23:00 | jeudi: 10:30 – 13:00, 17:00 – 23:30 | vendredi: 10:30 – 13:00, 17:00 – 23:30 | samedi: 17:00 – 00:00 | dimanche: 10:00 – 23:00",,"convenience_store, store",https://maps.google.com/?cid=18415432521116794271,Horaires indiqué non respecté | très souvent ferme sans raison,sympathique,vos horaires sont introuvables ou incorrects en ligne,"2 de vos clients sur Google se plaignent du meme probleme : vos horaires sont introuvables ou incorrects en ligne. Un d'eux a meme ecrit : ""Horaires indiqué non respecté"" C'est frustrant, et vos clients se deplacent pour rien. La solution : un site avec vos horaires toujours a jour.",A contacter,,,,,,,
216,Commerce,Epicerie,Rennes,Afghan Market,"14 Rue de l'Alma 14, 35000 Rennes, France",07 69 18 49 73,,NON,NON,4.5,67,,livraison,10,lundi: 10:00 – 21:00 | mardi: 10:00 – 21:00 | mercredi: 10:00 – 21:00 | jeudi: 10:00 – 21:00 | vendredi: 10:00 – 21:00 | samedi: 10:00 – 21:00 | dimanche: 10:00 – 21:00,,"grocery_or_supermarket, store, supermarket",https://maps.google.com/?cid=5492900981095441002,"J'y suis allée pour faire des achats, mais le personnel est impoli et leur communication, verbale et non verbale, était totalement inappropriée. En fait, on ne trouve pas ce genre de service sur les a | 10€ pour garder ma valise 1h , consigne trop chère mais une des seules qui fonctionnent sans application","accueil, qualite, propre",peu d'avis Google,"Vous n'avez que 5 avis sur Google. Vos concurrents en ont souvent 10x plus. Sans site web, vous etes invisible pour les gens qui cherchent votre activite.",A contacter,,,,,,,
217,Restauration,Traiteur,Reims,show truck,"41 Rue Hannah Arendt, 51100 Reims, France",06 99 39 77 21,,NON,NON,4.0,7,,"livraison, PMR",6,lundi: 08:00 – 17:00 | mardi: 08:00 – 17:00 | mercredi: 08:00 – 17:00 | jeudi: 08:00 – 17:00 | vendredi: 08:00 – 17:00 | samedi: 08:00 – 17:00 | dimanche: Fermé,,restaurant,https://maps.google.com/?cid=16519672645385925020,"Impossible de mettre 0 étoile car ça le mériterai
La nourriture est infâme
Pas d’assaisonnement et si vous voulez assaisonner votre salade c’est mayo ketchup.
Ne demandez pas une cuillère en plus car ","maison, excellent, sympathique",peu d'avis Google,"Vous n'avez que 5 avis sur Google. Vos concurrents en ont souvent 10x plus. Sans site web, vous etes invisible pour les gens qui cherchent votre activite.",A contacter,,,,,,,
218,Restauration,Boulangerie,Reims,Le Pavé de Murigny,"Rue Vauban, 51100 Reims, France",07 44 24 23 79,,NON,NON,4.4,126,,"a emporter, PMR",10,lundi: 07:00 – 20:00 | mardi: 07:00 – 20:00 | mercredi: 07:00 – 20:00 | jeudi: 07:00 – 20:00 | vendredi: 07:00 – 20:00 | samedi: Fermé | dimanche: 07:00 – 19:00,,"bakery, store",https://maps.google.com/?cid=18237807353488985083,,"accueil, chaleureux, frais",peu d'avis Google,"Vous n'avez que 5 avis sur Google. Vos concurrents en ont souvent 10x plus. Sans site web, vous etes invisible pour les gens qui cherchent votre activite.",A contacter,,,,,,,
219,Beaute,Barbier,Reims,K&W Barber Shop,"4 Rue Jean Jaurès, 51350 Cormontreuil, France",06 28 80 61 80,,NON,NON,4.3,6,,,9,lundi: Fermé | mardi: 11:30 – 19:00 | mercredi: 11:30 – 19:00 | jeudi: 11:30 – 19:00 | vendredi: 11:30 – 19:30 | samedi: 11:30 – 19:00 | dimanche: 11:30 – 19:00,,hair_care,https://maps.google.com/?cid=5429170340170717122,,"accueil, top",peu d'avis Google,"Vous n'avez que 5 avis sur Google. Vos concurrents en ont souvent 10x plus. Sans site web, vous etes invisible pour les gens qui cherchent votre activite.",A contacter,,,,,,,
220,Beaute,Barbier,Reims,Royal Barbershop,"9 Pl. du commerce, 51430 Tinqueux, France",06 59 05 61 34,,NON,NON,4.2,9,,,1,"lundi: 10:00 – 19:00 | mardi: 10:00 – 19:00 | mercredi: 10:00 – 19:00 | jeudi: 10:00 – 19:00 | vendredi: 10:00 – 12:00, 15:00 – 19:00 | samedi: 10:00 – 19:00 | dimanche: Fermé",,store,https://maps.google.com/?cid=14766252527605331738,,"accueil, conseil, professionnel",peu d'avis Google,"Vous n'avez que 5 avis sur Google. Vos concurrents en ont souvent 10x plus. Sans site web, vous etes invisible pour les gens qui cherchent votre activite.",A contacter,,,,,,,
221,Artisan,Electricien,Reims,SEBELEC,"35 Rue des Blancs Monts, 51350 Cormontreuil, France",06 20 99 20 50,,NON,NON,4.5,10,,,0,lundi: 08:00 – 17:00 | mardi: 08:00 – 17:00 | mercredi: 08:00 – 17:00 | jeudi: 08:00 – 17:00 | vendredi: 08:00 – 17:00 | samedi: Fermé | dimanche: Fermé,,electrician,https://maps.google.com/?cid=4358701558370352836,"Une Horreur!!!

Un électricien de sebelec est intervenu à mon domicile pour un problème de prise électrique, des son arrivée déjà  pas très aimable, froid. voulant aller au plus vite, et n à absolumen","accueil, professionnel, ponctuel",peu d'avis Google,"Vous n'avez que 5 avis sur Google. Vos concurrents en ont souvent 10x plus. Sans site web, vous etes invisible pour les gens qui cherchent votre activite.",A contacter,,,,,,,
222,Artisan,Carreleur,Reims,Carreleur REIMS Ets Rué Jérémy,"51100 Reims, France",06 34 04 18 21,,NON,NON,4.2,10,,,10,lundi: 08:00 – 19:00 | mardi: 08:00 – 19:00 | mercredi: 08:00 – 19:00 | jeudi: 08:00 – 19:00 | vendredi: 08:00 – 19:00 | samedi: 08:00 – 12:00 | dimanche: Fermé,,general_contractor,https://maps.google.com/?cid=15216512646559664236,"Travail bâclé, les carrelages ne sont pas alignés et le sol fini pas plane. Jamais revenu pour finir l'accès à la cave... Beaucoup de blabla et vilain résultat. Pourtant conseillé par Point P ! | Pas si sérieux que ça !
Prise d’un rendez-vous pour devis
Report de ce dernier au lendemain sans explications……….
………..Et le jour suivant, rendez-vous non honoré toujours sans explications ni excuses ","professionnel, qualite, ecoute",impossible de reserver ou prendre rendez-vous en ligne,"Un de vos clients sur Google signale que c'est impossible de reserver ou prendre rendez-vous en ligne. Un d'eux a meme ecrit : ""Prise d’un rendez-vous pour devis"" C'est frustrant, surtout le soir ou le week-end quand vous etes ferme. La solution : un systeme de reservation en ligne qui fonctionne meme quand vous dormez.",A contacter,,,,,,,
223,Artisan,Carreleur,Reims,Design Karo,"141 Rue de la Maison Blanche, 51100 Reims, France",06 11 67 70 46,,NON,NON,4.5,8,,,10,lundi: 07:30 – 19:00 | mardi: 07:30 – 19:00 | mercredi: 07:30 – 19:00 | jeudi: 07:30 – 19:00 | vendredi: 07:30 – 19:00 | samedi: 07:00 – 00:30 | dimanche: Fermé,,general_contractor,https://maps.google.com/?cid=1946462609885488329,,"disponible, excellent, sympathique",peu d'avis Google,"Vous n'avez que 5 avis sur Google. Vos concurrents en ont souvent 10x plus. Sans site web, vous etes invisible pour les gens qui cherchent votre activite.",A contacter,,,,,,,
224,Sport & Sante,Dentiste,Reims,Docteur Julie BROCHART,"Pôle Santé Dunkerque, 51 Rue de Dunkerque, 51100 Reims, France",06 34 21 85 71,,NON,NON,3.7,6,,,4,"lundi: 08:30 – 12:30, 13:30 – 17:30 | mardi: 08:30 – 12:30, 13:30 – 17:30 | mercredi: Fermé | jeudi: 08:30 – 12:30, 13:30 – 17:30 | vendredi: 09:00 – 12:30 | samedi: Fermé | dimanche: Fermé",,health,https://maps.google.com/?cid=18010827383888323613,"Arnaqueur dans cette agence inadmissible on m’a fait croire que j’allais être rembourser par la mutuel j’en sais quoi on m’a facturer 600€ et plus de nouvel après j’ai appeler on me dit c’est pas de l | Le première impression est toujours là bonne !
Si les dentistes sont à l'image de leur secrétaire n'essayez même pas !
J'avais déjà pris un rdv pour moi il y a quelques temps, j'ai eu un petit contret","gentil, excellent, professionnel",impossible de reserver ou prendre rendez-vous en ligne,"Un de vos clients sur Google signale que c'est impossible de reserver ou prendre rendez-vous en ligne. Un d'eux a meme ecrit : ""J'avais déjà pris un rdv pour moi il y a quelques temps, j'ai eu un petit contretemps, j'ai voulu les prévenir, malheureusement pe"" C'est frustrant, surtout le soir ou le week-end quand vous etes ferme. La solution : un systeme de reservation en ligne qui fonctionne meme quand vous dormez.",A contacter,,,,,,,
225,Hotellerie,Gite,Reims,MAISON D'HOTES REMOISE,"6 bis Rue Marie Stuart, 51100 Reims, France",06 13 42 17 13,,NON,NON,4.5,28,,,10,,Établissement de style décontracté avec cour et chambres d'hôtes/logements clairs au centre-ville.,lodging,https://maps.google.com/?cid=10411055851112900638,,"qualite, accueil, frais",peu d'avis Google,"Vous n'avez que 5 avis sur Google. Vos concurrents en ont souvent 10x plus. Sans site web, vous etes invisible pour les gens qui cherchent votre activite.",A contacter,,,,,,,
226,Auto,Garage,Reims,Brillance Auto,"5 Rue Marie Louise Burgert Neuv, 51100 Reims, France",06 09 35 76 71,,NON,NON,4.6,28,,PMR,10,"lundi: 08:00 – 12:00, 14:00 – 18:00 | mardi: 08:00 – 12:00, 14:00 – 18:00 | mercredi: 08:00 – 12:00, 14:00 – 18:00 | jeudi: 08:00 – 12:00, 14:00 – 18:00 | vendredi: 08:00 – 12:00, 14:00 – 18:00 | samedi: Fermé | dimanche: Fermé",,car_repair,https://maps.google.com/?cid=15079209332218136911,,"professionnel, rapide, qualite",peu d'avis Google,"Vous n'avez que 5 avis sur Google. Vos concurrents en ont souvent 10x plus. Sans site web, vous etes invisible pour les gens qui cherchent votre activite.",A contacter,,,,,,,
227,Commerce,Epicerie,Reims,L’Épicerie Du Monde,"44 Rue Pierre Taittinger, 51100 Reims, France",07 67 64 72 75,,NON,NON,3.1,65,,,2,lundi: 09:30 – 20:00 | mardi: 09:30 – 20:00 | mercredi: 09:30 – 20:00 | jeudi: 09:30 – 20:00 | vendredi: 09:30 – 20:00 | samedi: 09:30 – 20:00 | dimanche: 10:00 – 19:30,,"grocery_or_supermarket, store",https://maps.google.com/?cid=9329984672720906330,"L’épicier est antipathique malpoli, vous lui parler. Il vous répond pas puisqu’il a ses AirPods.
Chipotes pour vous donner un sac en plastique
Ces produits sont presque tous périmés
Monsieur, vous n’a | A fuir, les produits ne sont pas contrôlés, les DLC sont dépassées, la qualité est médiocre, l'accueil laisse tombé, ils font la gueule, j'ai eu une intoxication alimentaire (maux de ventre, diarrhées",propre,les clients ne peuvent pas voir vos realisations avant de vous choisir,"3 de vos clients sur Google se plaignent du meme probleme : les clients ne peuvent pas voir vos realisations avant de vous choisir. Un d'eux a meme ecrit : ""A fuir, les produits ne sont pas contrôlés, les DLC sont dépassées, la qualité est médiocre, l'accueil laisse tombé, ils font la g"" C'est frustrant, ce qui vous fait perdre des clients face a des concurrents mieux visibles. La solution : une galerie photo de vos meilleurs travaux.",A contacter,,,,,,,
228,Commerce,Epicerie,Reims,+229 Shopping,"13 Pl. Louis Demaison, 28 Rue de l'Adriatique, 51100 Reims, France",07 58 75 79 65,,NON,NON,4.4,13,,livraison,10,"lundi: 10:30 – 11:15, 13:35 – 21:00 | mardi: 10:30 – 11:15, 13:35 – 21:00 | mercredi: 10:00 – 21:00 | jeudi: 10:30 – 11:15, 13:35 – 21:00 | vendredi: 10:30 – 11:15, 13:35 – 21:00 | samedi: 10:00 – 21:00 | dimanche: 10:00 – 21:00",,"grocery_or_supermarket, store",https://maps.google.com/?cid=16210675794171357441,"franchement je ne recommande pas. Les horaires d’ouverture et fermeture ne sont pas respectés, tout est 2 fois plus que dans les autres magasins, l’accueil est toujours au téléphone et t’écoute a pein","accueil, propre",vos horaires sont introuvables ou incorrects en ligne,"Un de vos clients sur Google signale que c'est vos horaires sont introuvables ou incorrects en ligne. Un d'eux a meme ecrit : ""Les horaires d’ouverture et fermeture ne sont pas respectés, tout est 2 fois plus que dans les autres magasins, l’accueil est touj"" C'est frustrant, et vos clients se deplacent pour rien. La solution : un site avec vos horaires toujours a jour.",A contacter,,,,,,,
229,Restauration,Pizzeria,Le Havre,PIZZA WINGS,"3 Rue Lesueur, 76600 Le Havre, France",06 35 86 74 33,,NON,NON,4.6,42,,"livraison, a emporter, sur place, click&collect",10,lundi: 11:00 – 00:30 | mardi: 11:00 – 00:00 | mercredi: 11:00 – 00:30 | jeudi: 11:00 – 00:30 | vendredi: 11:00 – 02:00 | samedi: 11:00 – 02:00 | dimanche: 11:00 – 01:00,,restaurant,https://maps.google.com/?cid=13004796779937607055,"Dessert moisi qui n'a pas ete conserve proprement, il faisait hyper chaud dans la piece, c'est impossible que les dessert soient propres a la consommation, j'ai achete une pizza chevre miel il n'y ava","qualite, accueil, rapide",peu d'avis Google,"Vous n'avez que 5 avis sur Google. Vos concurrents en ont souvent 10x plus. Sans site web, vous etes invisible pour les gens qui cherchent votre activite.",A contacter,,,,,,,
230,Restauration,Boulangerie,Le Havre,Boulangerie De Saint François,"13 Rue du Général Faidherbe, 76600 Le Havre, France",06 60 93 97 84,,NON,NON,4.1,120,budget,a emporter,10,"lundi: 06:30 – 14:00, 15:30 – 20:00 | mardi: 06:30 – 14:00, 15:30 – 20:00 | mercredi: 06:30 – 14:00, 15:30 – 20:00 | jeudi: 06:30 – 14:00, 15:30 – 20:00 | vendredi: 06:30 – 14:00, 15:30 – 20:00 | samedi: 06:30 – 14:00, 15:30 – 20:00 | dimanche: Fermé",,"bakery, store",https://maps.google.com/?cid=8091627456447130842,"Le refus du propriétaire a reconnaître ses manquements me conduit à diminuer d'une étoile.
Ne fréquentez pas ce commerce ou en dépannage, dommage car il y a de jolies propositions mais rassies
Boulang | Formule 7 euros décevante. Je viens ponctuellement pour me dépanner le midi je suis malheureusement toujours déçu. Le flan est trop cuit (très sec) et le pain trop classique pour le sandwich. Ok pour ","maison, qualite, propre",peu d'avis Google,"Vous n'avez que 5 avis sur Google. Vos concurrents en ont souvent 10x plus. Sans site web, vous etes invisible pour les gens qui cherchent votre activite.",A contacter,,,,,,,
231,Beaute,Barbier,Le Havre,Barber star,"185 Av. du 8 Mai 1945, 76050 Le Havre, France",06 03 93 75 97,,NON,NON,4.3,33,,,1,lundi: 10:00 – 20:00 | mardi: 10:00 – 20:00 | mercredi: 10:00 – 20:00 | jeudi: 10:00 – 20:00 | vendredi: 10:00 – 20:00 | samedi: 10:00 – 20:00 | dimanche: 10:00 – 20:00,,hair_care,https://maps.google.com/?cid=16027055120112180465,"Coiffeurs très compétents mais que d’attentes… surtout les vendredis soir | Jusqu'à maintenant j'étais plutôt satisfait mais là j allucine . Déjà c'est pas ouvert à 10h comme c est marqué à 10h30 toujours pas ouvert , à 11h j y retourne le mec est la il plis ses serviettes ne","professionnel, qualite, gentil",l'organisation des rendez-vous cree de l'attente,"2 de vos clients sur Google se plaignent du meme probleme : l'organisation des rendez-vous cree de l'attente. Un d'eux a meme ecrit : ""Coiffeurs très compétents mais que d’attentes… surtout les vendredis soir"" C'est frustrant, ce qui frustre vos clients fideles. La solution : un systeme de reservation en ligne qui evite les embouteillages.",A contacter,,,,,,,
232,Beaute,Barbier,Le Havre,Salon 257 coiffure et barbier,"257 Rue Aristide Briand, 76600 Le Havre, France",06 16 88 69 31,,NON,NON,4.3,55,,,6,"lundi: 09:30 – 19:00 | mardi: 09:30 – 19:00 | mercredi: 09:30 – 19:00 | jeudi: 09:30 – 19:00 | vendredi: 09:30 – 12:00, 14:00 – 19:00 | samedi: 09:00 – 19:00 | dimanche: 09:30 – 19:00",,hair_care,https://maps.google.com/?cid=12208328242137964813,,"accueil, top, rapide",peu d'avis Google,"Vous n'avez que 5 avis sur Google. Vos concurrents en ont souvent 10x plus. Sans site web, vous etes invisible pour les gens qui cherchent votre activite.",A contacter,,,,,,,
233,Artisan,Plombier,Le Havre,ALL RENOV 76,"167 Rue Demidoff, 76600 Le Havre, France",07 49 86 21 05,,NON,NON,4.6,18,,,10,,,"electrician, general_contractor, painter, plumber",https://maps.google.com/?cid=7937752255310836643,Un technicien est venu pour la rénovation de mon sol en octobre et depuis plus de son plus d'image malgré mes nombreux appels et msg vocaux + sms. C'est inadmissible. J'ai enfin pu réussir à le contac,"sympathique, professionnel, rapide",les clients ne peuvent pas voir vos realisations avant de vous choisir,"Un de vos clients sur Google signale que c'est les clients ne peuvent pas voir vos realisations avant de vous choisir. Un d'eux a meme ecrit : ""Il indique aussi avoir passé du temps lors de la première visite or il est resté deux minutes le temps d'une photo pour repartir e"" C'est frustrant, ce qui vous fait perdre des clients face a des concurrents mieux visibles. La solution : une galerie photo de vos meilleurs travaux.",A contacter,,,,,,,
234,Artisan,Plombier,Le Havre,NBL.PLOMBERIE,"76610 Le Havre, France",06 15 79 19 94,,NON,NON,3.6,16,,,10,lundi: Ouvert 24h/24 | mardi: Ouvert 24h/24 | mercredi: Ouvert 24h/24 | jeudi: Ouvert 24h/24 | vendredi: Ouvert 24h/24 | samedi: Ouvert 24h/24 | dimanche: Ouvert 24h/24,,"electrician, plumber",https://maps.google.com/?cid=1821210110170435149,"Le plombier est intervenu 10 min pour nous préconiser de « remplacer toutes les canalisations » alors qu’un simple débouchage suffisait.
Au final, il a endommagé un wc broyeur (il ne fonctionne plus s | La Personne , et venue  10 min pour au final abîmé un wc semi broyeur , qui nous dit qui fait déboucher les canalisation redonne un rdv et même pas capable de venir , et pour au final bloquer le numér","rapide, professionnel, efficace",difficile a joindre par telephone,"Un de vos clients sur Google signale que c'est difficile a joindre par telephone. Un d'eux a meme ecrit : ""Quand on les a au téléphone"" C'est frustrant, surtout quand on a besoin d'un renseignement ou d'un devis urgent. La solution : un formulaire de contact en ligne disponible 24h/24.",A contacter,,,,,,,
235,Artisan,Peintre,Le Havre,kana peinture,"60 Rue de Rivoli, 76600 Le Havre, France",07 52 13 68 33,,NON,NON,4.4,7,,,5,lundi: Ouvert 24h/24 | mardi: Ouvert 24h/24 | mercredi: Ouvert 24h/24 | jeudi: Ouvert 24h/24 | vendredi: Ouvert 24h/24 | samedi: Ouvert 24h/24 | dimanche: Ouvert 24h/24,,painter,https://maps.google.com/?cid=10659169910961629683,,,peu d'avis Google,"Vous n'avez que 5 avis sur Google. Vos concurrents en ont souvent 10x plus. Sans site web, vous etes invisible pour les gens qui cherchent votre activite.",A contacter,,,,,,,
236,Artisan,Chauffagiste,Le Havre,Entreprise Bichot,"117 Rue Roland Garros, 76600 Le Havre, France",07 86 29 95 65,,NON,NON,3.4,7,,,1,lundi: 08:00 – 17:30 | mardi: 08:00 – 17:30 | mercredi: 08:00 – 17:30 | jeudi: 08:00 – 17:30 | vendredi: 08:00 – 16:00 | samedi: Fermé | dimanche: Fermé,,"general_contractor, plumber",https://maps.google.com/?cid=15645662451717859112,Entreprise qui préfère exécuté les contrats financier lucratif en urgence plutôt que les urgences des locataires et propriétaires qui plus est avec bébé ... qui n'ont plus de chauffage ni d'eau chaude,propre,peu d'avis Google,"Vous n'avez que 5 avis sur Google. Vos concurrents en ont souvent 10x plus. Sans site web, vous etes invisible pour les gens qui cherchent votre activite.",A contacter,,,,,,,
