#,Categorie,Secteur,Ville,Nom,Adresse,Telephone,Email,Site?,Email?,Note,Nb Avis,Gamme Prix,Services,Nb Photos,Horaires,Editorial,Types Google,URL Maps,Citation Neg,Points Forts,Probleme,Accroche Email,Statut,1er contact,Relance 1,Relance 2,Relance 3,RDV,Call booke,Notes
337,Restauration,Kebab,Nimes,Le Carré Gourmand,"46 Bd Victor Hugo, 30000 Nîmes, France",07 67 25 03 75,,NON,NON,3.4,123,,"livraison, a emporter, sur place, vegetarien, petit-dej, dejeuner, diner, PMR",10,lundi: 11:00 – 23:30 | mardi: 11:00 – 00:00 | mercredi: 11:00 – 00:00 | jeudi: 11:00 – 00:00 | vendredi: 11:00 – 00:00 | samedi: 11:00 – 00:00 | dimanche: 11:00 – 23:30,,restaurant,https://maps.google.com/?cid=9915087121403764658,Frite cru juste huileuse j'ai pas pu manger mon américain un scandale 14 euros dans le vent plus jamais | Je n’ai jamais mit de commentaire de toute ma vie sur un restaurant. Mais celui-ci est à éviter. Plus jamais ! J’ai bien précisé au monsieur que je ne voulais pas de frite dans mon tacos car je n’en m,"accueil, rapide",vos horaires sont introuvables ou incorrects en ligne,"Un de vos clients sur Google signale que c'est vos horaires sont introuvables ou incorrects en ligne. Un d'eux a meme ecrit : ""Il faut vraiment fermer cet endroit"" C'est frustrant, et vos clients se deplacent pour rien. La solution : un site avec vos horaires toujours a jour.",A contacter,,,,,,,
338,Restauration,Kebab,Nimes,Ô Snack St Cesaire,"25 Rue de Mascard, 30900 Nîmes, France",07 49 62 78 46,,NON,NON,4.4,49,,"livraison, a emporter, sur place, dejeuner, diner",10,"lundi: 10:30 – 14:00, 18:00 – 00:00 | mardi: 10:30 – 14:00, 18:00 – 00:00 | mercredi: 10:30 – 14:00, 18:00 – 00:00 | jeudi: 10:30 – 14:00, 18:00 – 00:00 | vendredi: 10:30 – 14:00, 18:00 – 00:00 | samedi: 10:30 – 14:00, 18:00 – 00:00 | dimanche: 18:00 – 00:00",,"meal_takeaway, restaurant",https://maps.google.com/?cid=2021196028170969027,"Franchement proche du sud les épices il l’es connais pas , pas de goût pas assaisonné à refaire une formation cuisine le tacos dégoulinant | Je voulais tester car y’a que des bons avis et je suis vraiment déçu de ce que j’ai reçu, j’ai prit le menu Big Mac et des nuggets et les images parlent d’elle-mêmes je me sens arnaquée","propre, sympathique, rapide",peu d'avis Google,"Vous n'avez que 5 avis sur Google. Vos concurrents en ont souvent 10x plus. Sans site web, vous etes invisible pour les gens qui cherchent votre activite.",A contacter,,,,,,,
339,Restauration,Kebab,Nimes,ÔCHWAYA Restaurant,"33 Av. du Général Leclerc, 30000 Nîmes, France",07 83 22 66 06,,NON,NON,4.5,277,,"livraison, a emporter, reservable en ligne, sur place, petit-dej, dejeuner, diner, PMR",10,"lundi: Fermé | mardi: 10:00 – 14:30, 19:30 – 22:30 | mercredi: 10:00 – 14:30, 19:30 – 22:30 | jeudi: 10:00 – 14:30, 19:30 – 22:30 | vendredi: 10:00 – 14:30, 19:30 – 22:30 | samedi: 10:00 – 14:30, 19:30 – 22:30 | dimanche: Fermé",,restaurant,https://maps.google.com/?cid=8668287194523771469,"Plus de 50€ de commande sur UBER, livrée à l’ICG, sans un seul couvert… Peut-être qu’ils pensaient que je devais manger avec les doigts ? 😅 Et 3€ pour une portion de frites miniature, j’ai cru que c’é","accueil, chaleureux, rapide",les clients ne trouvent pas vos tarifs avant de vous contacter,"Un de vos clients sur Google signale que c'est les clients ne trouvent pas vos tarifs avant de vous contacter. Un d'eux a meme ecrit : ""Franchement, à ce prix-là, on s’attend à mieux"" C'est frustrant, ce qui fait fuir ceux qui veulent juste une idee du budget. La solution : une page tarifs claire qui pre-qualifie vos clients.",A contacter,,,,,,,
340,Restauration,Traiteur,Nimes,Maison busquet,"13 Rue Guizot, 30000 Nîmes, France",06 40 64 56 69,,NON,NON,4.3,37,,"livraison, a emporter",2,lundi: Fermé | mardi: Fermé | mercredi: Fermé | jeudi: Fermé | vendredi: Fermé | samedi: Fermé | dimanche: Ouvert 24h/24,,,https://maps.google.com/?cid=17713381370982340394,"Incroyablement déçu de ma commande dans cette épicerie, pour un total de 30€ nous ne mangeons rien. Deux coucous 3 viandes commandé, seulement deux viandes y sont présente, les légumes sont en conserv","accueil, maison, sympathique",peu d'avis Google,"Vous n'avez que 5 avis sur Google. Vos concurrents en ont souvent 10x plus. Sans site web, vous etes invisible pour les gens qui cherchent votre activite.",A contacter,,,,,,,
341,Restauration,Boulangerie,Nimes,Maison Amara,"16 Rue des Fourbisseurs, 30000 Nîmes, France",07 82 92 88 43,,NON,NON,4.2,203,,"a emporter, petit-dej, PMR",10,lundi: 07:30 – 19:30 | mardi: 07:30 – 19:30 | mercredi: 07:30 – 19:30 | jeudi: 07:30 – 19:30 | vendredi: 07:30 – 19:30 | samedi: 07:30 – 19:30 | dimanche: Fermé,,"bakery, store",https://maps.google.com/?cid=10012048121425229691,,"qualite, accueil, serieux",peu d'avis Google,"Vous n'avez que 5 avis sur Google. Vos concurrents en ont souvent 10x plus. Sans site web, vous etes invisible pour les gens qui cherchent votre activite.",A contacter,,,,,,,
342,Restauration,Boulangerie,Nimes,La douceur de l'Artisan,"127 Rte d'Alès, 30900 Nîmes, France",07 69 82 26 69,,NON,NON,4.0,141,,a emporter,10,lundi: 06:00 – 19:30 | mardi: 06:00 – 19:30 | mercredi: 06:00 – 19:30 | jeudi: 06:00 – 19:30 | vendredi: 06:00 – 19:30 | samedi: 06:00 – 19:30 | dimanche: 06:30 – 13:00,,"bakery, store",https://maps.google.com/?cid=2221189840771126810,"Déçue de l’expérience, trompe l’œil mal réalisés avec finitions très grossières (l’œil n’est clairement pas trompé) ce n’est vraiment pas beau et pas ce que l’on peut attendre d’un trompe l’œil. Conce | Très déçu. Niveau hygiène, c’est inacceptable : les produits sont servis à la main, sans gants, sans pince ni protection. En boulangerie, le respect des règles d’hygiène est essentiel, surtout quand o","accueil, chaleureux, delicieux",les clients ne trouvent pas vos tarifs avant de vous contacter,"2 de vos clients sur Google se plaignent du meme probleme : les clients ne trouvent pas vos tarifs avant de vous contacter. Un d'eux a meme ecrit : ""La vendeuse a cependant été agréable et a su me dire de quoi était composée chaque pâtisserie ainsi que le prix car rien de cela n"" C'est frustrant, ce qui fait fuir ceux qui veulent juste une idee du budget. La solution : une page tarifs claire qui pre-qualifie vos clients.",A contacter,,,,,,,
343,Restauration,Boulangerie,Nimes,Maison Jailliard,"2 Rue des Lombards, 30000 Nîmes, France",06 74 56 69 72,,NON,NON,4.4,124,,"a emporter, sur place, petit-dej",10,lundi: Fermé | mardi: 09:00 – 18:00 | mercredi: 09:00 – 18:00 | jeudi: 09:00 – 18:00 | vendredi: 09:00 – 19:00 | samedi: 09:00 – 19:00 | dimanche: Fermé,,"bakery, restaurant, store",https://maps.google.com/?cid=16797822562945481069,"Nous avons été très déçus des pâtisseries. Tellement grasses et sucrées que nous avons été barbouillés durant des heures après la dégustation. Aussi j'ai un sérieux doute quant à la fraîcheur car les  | Comment dire : pour y être allés spécialement pour le brunch du samedi matin, nous avons été déçus par la publicité réalisée dans les médias, les pages appétissantes du site Web et la réalité de l'off","accueil, delicieux, excellent",l'organisation des rendez-vous cree de l'attente,"Un de vos clients sur Google signale que c'est l'organisation des rendez-vous cree de l'attente. Un d'eux a meme ecrit : ""Même si l'accueil est chaleureux et attentionné, les prestations proposées ne reflètent pas ce que l'on peut attendre d'un établis"" C'est frustrant, ce qui frustre vos clients fideles. La solution : un systeme de reservation en ligne qui evite les embouteillages.",A contacter,,,,,,,
344,Restauration,Boulangerie,Nimes,La Petite Gourmandise,"43 Rue de l'Occitanie, 30000 Nîmes, France",06 69 07 81 11,,NON,NON,4.6,24,,,3,lundi: Ouvert 24h/24 | mardi: Ouvert 24h/24 | mercredi: Ouvert 24h/24 | jeudi: Ouvert 24h/24 | vendredi: Ouvert 24h/24 | samedi: Ouvert 24h/24 | dimanche: Ouvert 24h/24,,"bakery, restaurant, store",https://maps.google.com/?cid=12623432061564820831,,"excellent, qualite, delicieux",peu d'avis Google,"Vous n'avez que 5 avis sur Google. Vos concurrents en ont souvent 10x plus. Sans site web, vous etes invisible pour les gens qui cherchent votre activite.",A contacter,,,,,,,
345,Restauration,Boulangerie,Nimes,Boulangerie Pâtisserie HW,"108 Rte d'Uzès, 30000 Nîmes, France",07 66 57 99 55,,NON,NON,4.3,82,,,6,lundi: 06:30 – 19:30 | mardi: 06:30 – 19:30 | mercredi: 06:30 – 19:30 | jeudi: 06:30 – 19:30 | vendredi: 06:30 – 19:30 | samedi: 06:30 – 19:30 | dimanche: 06:30 – 13:00,,"bakery, store",https://maps.google.com/?cid=13476345190346970076,"J’avais l’habitude d’aller à HW de la route d’Alès et je n’ai jamais été déçu. Depuis que j’ai emménagé route d’Uzès, je me suis rendu plusieurs fois dans cette boulangerie et, malheureusement, l’expé | Je vous déconseille cette boulangerie.
La vendeuse ne connaissait absolument pas les produits qu’elle vendait.
Nous en avons eu pour 17€, la pizza est bof, on nous a vendu un suisse en nous disant c’e",,impossible de reserver ou prendre rendez-vous en ligne,"Un de vos clients sur Google signale que c'est impossible de reserver ou prendre rendez-vous en ligne. Un d'eux a meme ecrit : ""Cheveux retrouvés dans l’emballage d’un sandwich, pâtisseries mal cuites avec l’intérieur encore cru, trompe-l’œil à la finition p"" C'est frustrant, surtout le soir ou le week-end quand vous etes ferme. La solution : un systeme de reservation en ligne qui fonctionne meme quand vous dormez.",A contacter,,,,,,,
346,Restauration,Boulangerie,Nimes,Les délices du mas,"1294 Rte de Courbessac, 30000 Nîmes, France",07 51 16 01 66,,NON,NON,4.1,29,,"a emporter, PMR",10,lundi: Fermé | mardi: 06:30 – 20:00 | mercredi: 06:30 – 20:00 | jeudi: 06:30 – 20:00 | vendredi: 06:30 – 20:00 | samedi: 06:30 – 20:00 | dimanche: Fermé,,"bakery, store",https://maps.google.com/?cid=9438360519216097078,"Une boulangerie qui a été reprise, mais rien à voir avec la qualité d'avant.Une jeune fille à l'accueil,qui n'a pas trop l'air de s'y connaitre dans les produits proposés et vendus nullement convainca | Mettre les horaires à jour sa va pas vous tuez au mieux de ns faire déplacer pour rien ! Déjà que sa laisse à désiré alors quand sur Google maps c marqué que vous êtes là seule ouvert alors que nan c ","accueil, delicieux, excellent",vos horaires sont introuvables ou incorrects en ligne,"Un de vos clients sur Google signale que c'est vos horaires sont introuvables ou incorrects en ligne. Un d'eux a meme ecrit : ""Mettre les horaires à jour sa va pas vous tuez au mieux de ns faire déplacer pour rien"" C'est frustrant, et vos clients se deplacent pour rien. La solution : un site avec vos horaires toujours a jour.",A contacter,,,,,,,
347,Restauration,Boulangerie,Nimes,BOULANGERIE FRIDA,"2 Rue de la Posterle, 30000 Nîmes, France",07 58 86 03 01,,NON,NON,4.4,42,,a emporter,4,"lundi: 07:00 – 13:00, 16:00 – 19:30 | mardi: 07:00 – 13:00, 16:00 – 19:30 | mercredi: 07:00 – 13:00, 16:00 – 19:30 | jeudi: 07:00 – 13:00, 16:00 – 19:30 | vendredi: 07:00 – 13:00, 16:00 – 19:30 | samedi: 07:00 – 13:00 | dimanche: 07:00 – 13:00",,"bakery, store",https://maps.google.com/?cid=181892992397893771,,"qualite, accueil, frais",peu d'avis Google,"Vous n'avez que 5 avis sur Google. Vos concurrents en ont souvent 10x plus. Sans site web, vous etes invisible pour les gens qui cherchent votre activite.",A contacter,,,,,,,
348,Restauration,Boulangerie,Nimes,La Graine d'Or,"75 Av. du Général Leclerc, 30000 Nîmes, France",06 13 65 01 26,,NON,NON,4.2,58,,"a emporter, PMR",3,"lundi: 06:00 – 13:00, 16:00 – 20:00 | mardi: 06:00 – 13:00, 16:00 – 20:00 | mercredi: 06:00 – 13:00, 16:00 – 20:00 | jeudi: 06:00 – 13:00, 16:00 – 20:00 | vendredi: 06:00 – 13:00, 16:00 – 20:00 | samedi: 06:00 – 13:00, 16:00 – 20:00 | dimanche: 06:00 – 13:00, 16:00 – 20:00",,"bakery, store",https://maps.google.com/?cid=17716169052024265455,"Dernière fois que je viens ici, j'ai payé 14 euro pour 4 mini gâteau mais vraiment minuscule, 1 montécao et un canette fait pas déconner a un moment donner! Il profites du ramadan pour te vendre les g | Bonjour cette boulangerie et juste top la vendeuse toujours souriante
Et a l'écoute du client sa fait plusieurs fois que je commande des gâteaux d'anniversaire pour mes enfants et il sont juste incroy","accueil, qualite",les clients ne trouvent pas vos tarifs avant de vous contacter,"2 de vos clients sur Google se plaignent du meme probleme : les clients ne trouvent pas vos tarifs avant de vous contacter. Un d'eux a meme ecrit : ""Pour le prix de 1,50€"" C'est frustrant, ce qui fait fuir ceux qui veulent juste une idee du budget. La solution : une page tarifs claire qui pre-qualifie vos clients.",A contacter,,,,,,,
349,Beaute,Coiffeur,Nimes,Beauty Hair Elegance,"8 Rue Traversière, 30900 Nîmes, France",06 09 30 58 21,,NON,NON,4.6,47,,,10,lundi: Fermé | mardi: 10:00 – 18:00 | mercredi: Fermé | jeudi: 10:00 – 18:00 | vendredi: 10:00 – 18:00 | samedi: 09:00 – 17:00 | dimanche: Fermé,,hair_care,https://maps.google.com/?cid=2763174986656833656,"HORRIBLE! 0 étoiles 🌟
Salon peut-être bien pour le brun mais surtout pas pour le blond !
Mes cheveux sont devenus élastiques, et le pire, c'est qu'aucun geste n'a été fait.Mes cheveux ont littéralemen","accueil, conseil, honnete",les clients ne trouvent pas vos tarifs avant de vous contacter,"Un de vos clients sur Google signale que c'est les clients ne trouvent pas vos tarifs avant de vous contacter. Un d'eux a meme ecrit : ""Vous aurez mieux ailleurs pour le même prix"" C'est frustrant, ce qui fait fuir ceux qui veulent juste une idee du budget. La solution : une page tarifs claire qui pre-qualifie vos clients.",A contacter,,,,,,,
350,Beaute,Barbier,Nimes,ÉLITE BARBER NÎMES,"38 Av. Jean Jaurès, 30900 Nîmes, France",06 28 75 80 25,,NON,NON,4.2,108,,,10,lundi: 09:30 – 20:00 | mardi: 09:30 – 20:00 | mercredi: 09:30 – 20:00 | jeudi: 09:30 – 20:00 | vendredi: 09:30 – 20:00 | samedi: 09:30 – 20:00 | dimanche: 09:30 – 20:00,,hair_care,https://maps.google.com/?cid=5465321394476915404,"Pire expérience de ma vie chez un coiffeur.

Je me suis fait charcuter, autant sur le résultat de la coupe qui n’est pas beau et même pas symétrique, je me fais entailler à l’oreille, dans le cou, à l","accueil, propre, chaleureux",peu d'avis Google,"Vous n'avez que 5 avis sur Google. Vos concurrents en ont souvent 10x plus. Sans site web, vous etes invisible pour les gens qui cherchent votre activite.",A contacter,,,,,,,
351,Beaute,Barbier,Nimes,Barber Cut,"90 Av. Jean Jaurès, 30900 Nîmes, France",07 67 70 94 01,,NON,NON,4.1,90,,,6,lundi: Fermé | mardi: 10:00 – 20:00 | mercredi: 10:00 – 20:00 | jeudi: 10:00 – 20:00 | vendredi: 10:00 – 20:00 | samedi: 10:00 – 20:00 | dimanche: 12:00 – 20:00,,"hair_care, health",https://maps.google.com/?cid=6002406263713506800,,"accueil, top, chaleureux",peu d'avis Google,"Vous n'avez que 5 avis sur Google. Vos concurrents en ont souvent 10x plus. Sans site web, vous etes invisible pour les gens qui cherchent votre activite.",A contacter,,,,,,,
352,Beaute,Barbier,Nimes,The Barber Street,"54 Rte de Beaucaire, 30000 Nîmes, France",07 55 89 46 69,,NON,NON,4.4,43,,,3,lundi: Fermé | mardi: 10:00 – 20:00 | mercredi: 10:00 – 20:00 | jeudi: 10:00 – 20:00 | vendredi: 10:00 – 20:00 | samedi: 10:00 – 20:00 | dimanche: 10:00 – 20:00,,"hair_care, health",https://maps.google.com/?cid=17021236857961667739,"N'applique pas les tarifs affichés, c'est à la tête du client . A part les dégradés ils ne savent pas couper des cheveux .

Je recommande pas . | Le coiffeur du milieu à lunette c’est un vrai boucher…","conseil, excellent",les clients ne trouvent pas vos tarifs avant de vous contacter,"Un de vos clients sur Google signale que c'est les clients ne trouvent pas vos tarifs avant de vous contacter. Un d'eux a meme ecrit : ""N'applique pas les tarifs affichés, c'est à la tête du client"" C'est frustrant, ce qui fait fuir ceux qui veulent juste une idee du budget. La solution : une page tarifs claire qui pre-qualifie vos clients.",A contacter,,,,,,,
353,Beaute,Barbier,Nimes,The barber coiff’,"28 Av. du Général Leclerc, 30000 Nîmes, France",07 53 07 36 76,,NON,NON,4.2,5,,,2,lundi: Fermé | mardi: Ouvert 24h/24 | mercredi: 09:00 – 19:00 | jeudi: 09:00 – 19:00 | vendredi: 09:00 – 19:00 | samedi: 09:00 – 19:00 | dimanche: 09:00 – 19:00,,"hair_care, health",https://maps.google.com/?cid=2680104062016412204,Pire coiffeur il ne c'est pas faire de dégrader il me fais une ligne tout droit même pas avec des étage et fais des travaux quand il nous coiffe n'allais pas je vous conseille fortement,"accueil, professionnel, chaleureux",peu d'avis Google,"Vous n'avez que 5 avis sur Google. Vos concurrents en ont souvent 10x plus. Sans site web, vous etes invisible pour les gens qui cherchent votre activite.",A contacter,,,,,,,
354,Beaute,Barbier,Nimes,Le blok 1.0,"1184 Av. Marechal Juin, 30900 Nîmes, France",07 49 10 33 15,,NON,NON,4.6,47,,PMR,1,lundi: Fermé | mardi: 10:00 – 20:00 | mercredi: 10:00 – 20:00 | jeudi: 10:00 – 20:00 | vendredi: 10:00 – 20:00 | samedi: 10:00 – 18:30 | dimanche: Fermé,,hair_care,https://maps.google.com/?cid=13858224654852198430,"Je me suis fait couper les cheveux et la barbe ce matin en rentrant chez moi, je me suis aperçu que le dégradé avait des traits qui ne devraient pas y être. La barbe a été sommairement coupé. Franchem","top, ecoute, conseil",peu d'avis Google,"Vous n'avez que 5 avis sur Google. Vos concurrents en ont souvent 10x plus. Sans site web, vous etes invisible pour les gens qui cherchent votre activite.",A contacter,,,,,,,
355,Beaute,Barbier,Nimes,Casanova,"10 Rue Vincent Faïta, 30000 Nîmes, France",06 50 37 06 34,,NON,NON,4.6,21,,,10,lundi: 09:00 – 19:00 | mardi: 09:00 – 19:30 | mercredi: 09:00 – 19:00 | jeudi: 09:00 – 19:00 | vendredi: 09:00 – 19:00 | samedi: 09:00 – 19:00 | dimanche: 09:00 – 19:00,,hair_care,https://maps.google.com/?cid=12195921447465387739,"Catastrophique, beau salon de l'extérieur, je pense avoir plus de compétence que la personne qui m'a taillé la barbe, c'est dire, Un vrai massacre.","professionnel, accueil, propre",les clients ne peuvent pas voir vos realisations avant de vous choisir,"Un de vos clients sur Google signale que c'est les clients ne peuvent pas voir vos realisations avant de vous choisir. Un d'eux a meme ecrit : ""Catastrophique, beau salon de l'extérieur, je pense avoir plus de compétence que la personne qui m'a taillé la barbe, c'est dire, "" C'est frustrant, ce qui vous fait perdre des clients face a des concurrents mieux visibles. La solution : une galerie photo de vos meilleurs travaux.",A contacter,,,,,,,
356,Artisan,Plombier,Nimes,UNIVERS PLOMBERIE,"50 Rue de l'Abrivado, 30000 Nîmes, France",06 62 91 20 82,,NON,NON,4.6,10,,,6,lundi: 08:00 – 18:00 | mardi: 08:00 – 18:00 | mercredi: 08:00 – 18:00 | jeudi: 08:00 – 18:00 | vendredi: 08:00 – 18:00 | samedi: Fermé | dimanche: Fermé,,plumber,https://maps.google.com/?cid=14212044972203089513,Ils sont venus faire des travaux chez nous pour la pose d’une VMC dans notre logement. Ça a été fait comme du n’importe quoi et de plus ils ont fait des trous à plusieurs endroits qui n’ont pas rebouc,"professionnel, rapide, propre",les clients ne peuvent pas voir vos realisations avant de vous choisir,"Un de vos clients sur Google signale que c'est les clients ne peuvent pas voir vos realisations avant de vous choisir. Un d'eux a meme ecrit : ""Ça a été fait comme du n’importe quoi et de plus ils ont fait des trous à plusieurs endroits qui n’ont pas rebouché pour que au fi"" C'est frustrant, ce qui vous fait perdre des clients face a des concurrents mieux visibles. La solution : une galerie photo de vos meilleurs travaux.",A contacter,,,,,,,
357,Artisan,Electricien,Nimes,Sam Elec,"31 rue de l'abrivadot, 30000 Nîmes, France",06 52 34 10 15,,NON,NON,4.5,17,,,0,,,electrician,https://maps.google.com/?cid=11320818061114131575,"Indisponibles par téléphone après une quinzaine d'appels et des dizaines de messages laissés sur répondeur et par sms
Travail inacceptable sur l'installation électrique de la maison et de la climatisa","professionnel, qualite, efficace",difficile a joindre par telephone,"Un de vos clients sur Google signale que c'est difficile a joindre par telephone. Un d'eux a meme ecrit : ""Indisponibles par téléphone après une quinzaine d'appels et des dizaines de messages laissés sur répondeur et par sms"" C'est frustrant, surtout quand on a besoin d'un renseignement ou d'un devis urgent. La solution : un formulaire de contact en ligne disponible 24h/24.",A contacter,,,,,,,
358,Artisan,Peintre,Nimes,Le.m.design,"29 Rue Jacques et Louis Heyral, 30000 Nîmes, France",07 66 20 30 35,,NON,NON,4.3,12,,,10,,,painter,https://maps.google.com/?cid=8129050639220563424,N habite plus à l adresse indiquée. Entreprise radiée.,"rapide, propre, soigneux",vos nouveaux clients ont du mal a vous trouver,"Un de vos clients sur Google signale que c'est vos nouveaux clients ont du mal a vous trouver. Un d'eux a meme ecrit : ""N habite plus à l adresse indiquée"" C'est frustrant, meme quand ils cherchent exactement ce que vous proposez. La solution : un site optimise pour apparaitre sur Google quand on cherche votre activite.",A contacter,,,,,,,
359,Artisan,Peintre,Nimes,Catalan Père et Fils S.A.S.,"6 Rue de Londres, 30000 Nîmes, France",06 23 89 68 29,,NON,NON,4.2,5,,,10,lundi: 07:30 – 17:30 | mardi: 07:30 – 17:30 | mercredi: 07:30 – 17:30 | jeudi: 07:30 – 17:30 | vendredi: 07:30 – 17:30 | samedi: 08:00 – 12:00 | dimanche: Fermé,,painter,https://maps.google.com/?cid=5575667026248813073,"Malheureusement mon expérience n’a pas été à la hauteur des autres avis… un travail bâclé, ce n’est pas à la hauteur d’un professionnel…","propre, conseil",peu d'avis Google,"Vous n'avez que 5 avis sur Google. Vos concurrents en ont souvent 10x plus. Sans site web, vous etes invisible pour les gens qui cherchent votre activite.",A contacter,,,,,,,
360,Artisan,Chauffagiste,Nimes,CLIM ELEC CEL,"539 Av. Jean Prouvé, 30900 Nîmes, France",06 52 76 41 29,,NON,NON,4.4,19,,,10,lundi: 07:00 – 19:00 | mardi: 07:00 – 19:00 | mercredi: 07:00 – 19:00 | jeudi: 07:00 – 19:00 | vendredi: 07:00 – 19:00 | samedi: 09:00 – 16:30 | dimanche: Fermé,,general_contractor,https://maps.google.com/?cid=7117928762859929936,"Installation de départ plutôt bien faite, hormis deux pompes de relevage ""d'un nouveau modèle"". 3 splits avec chacun leur groupe externe sur deux bâtiments, budget en conséquence. Les deux pompes inst","rapide, efficace, professionnel",difficile a joindre par telephone,"Un de vos clients sur Google signale que c'est difficile a joindre par telephone. Un d'eux a meme ecrit : ""Or M Campos ne répond pas au tel, et après plusieurs relances et 24h après un rendez-vous non honoré me dit, par SMS, d'aller vers"" C'est frustrant, surtout quand on a besoin d'un renseignement ou d'un devis urgent. La solution : un formulaire de contact en ligne disponible 24h/24.",A contacter,,,,,,,
361,Artisan,Chauffagiste,Nimes,AED Climatisation Plomberie,"19 Rue d'Aquitaine, 30000 Nîmes, France",07 60 10 31 32,,NON,NON,4.1,13,,,3,lundi: 07:00 – 19:00 | mardi: 07:00 – 19:00 | mercredi: 07:00 – 19:00 | jeudi: 07:00 – 19:00 | vendredi: 07:00 – 19:00 | samedi: 07:00 – 18:00 | dimanche: Fermé,,general_contractor,https://maps.google.com/?cid=16017326270287755041,,"conseil, rapide, professionnel",peu d'avis Google,"Vous n'avez que 5 avis sur Google. Vos concurrents en ont souvent 10x plus. Sans site web, vous etes invisible pour les gens qui cherchent votre activite.",A contacter,,,,,,,
362,Artisan,Serrurier,Nimes,SOS SERRURIER,"40 Rue de la Pérouse, 30900 Nîmes, France",07 57 95 73 22,,NON,NON,4.2,5,,,10,lundi: Ouvert 24h/24 | mardi: Ouvert 24h/24 | mercredi: Ouvert 24h/24 | jeudi: Ouvert 24h/24 | vendredi: Ouvert 24h/24 | samedi: Ouvert 24h/24 | dimanche: Ouvert 24h/24,,locksmith,https://maps.google.com/?cid=5498366353154100430,"Un bel arnaqueur ! (et je reste très poli) AUCUN TARIF Annoncé lors de l'appel malgré ma demande.
500€ pour éclater ma porte. peur de rien.
Limite menaçant. si j'insiste on se met dessus. Je pense que",,les clients ne trouvent pas vos tarifs avant de vous contacter,"Un de vos clients sur Google signale que c'est les clients ne trouvent pas vos tarifs avant de vous contacter. Un d'eux a meme ecrit : ""(et je reste très poli) AUCUN TARIF Annoncé lors de l'appel malgré ma demande"" C'est frustrant, ce qui fait fuir ceux qui veulent juste une idee du budget. La solution : une page tarifs claire qui pre-qualifie vos clients.",A contacter,,,,,,,
