#,Categorie,Secteur,Ville,Nom,Adresse,Telephone,Email,Site?,Email?,Note,Nb Avis,Gamme Prix,Services,Nb Photos,Horaires,Editorial,Types Google,URL Maps,Citation Neg,Points Forts,Probleme,Accroche Email,Statut,1er contact,Relance 1,Relance 2,Relance 3,RDV,Call booke,Notes
1,Restauration,Kebab,Paris,Paristanbul,"154 Rue du Chemin Vert, 75011 Paris, France",07 82 37 03 41,,NON,NON,4.6,603,,"livraison, a emporter, sur place, dejeuner",10,lundi: 11:00 – 02:00 | mardi: 11:00 – 02:00 | mercredi: 11:00 – 02:00 | jeudi: 11:00 – 02:00 | vendredi: 11:00 – 02:00 | samedi: 11:00 – 02:00 | dimanche: 11:00 – 02:00,,restaurant,https://maps.google.com/?cid=15089367271399021933,,"qualite, accueil, chaleureux",peu d'avis Google,"Vous n'avez que 5 avis sur Google. Vos concurrents en ont souvent 10x plus. Sans site web, vous etes invisible pour les gens qui cherchent votre activite.",A contacter,,,,,,,
2,Restauration,Kebab,Paris,Paris Antalya,"24 Rue Saint-Séverin, 75005 Paris, France",06 50 50 20 96,,NON,NON,4.5,184,,"a emporter, sur place, dejeuner, diner",10,lundi: 08:00 – 02:00 | mardi: 08:00 – 02:00 | mercredi: 08:00 – 02:00 | jeudi: 08:00 – 02:00 | vendredi: 08:00 – 02:00 | samedi: 08:00 – 02:00 | dimanche: 08:00 – 02:00,,"bar, restaurant",https://maps.google.com/?cid=10155300356443210948,"La viande est délicieuse, les serveurs sont sympas et accueillants, le pain pyta est bon.
Mais changez moi vos frites! Surgelées, de mauvaises qualité, on croirait des frites reconstituées !! Où est p | Pris 2 kebabs différents avec frites et malgré les promesses du vendeur (peut être patron), on était très loin du meilleur kébab de Paris car il ni le pain ni la viande et encore moins les frites n'ét","accueil, sympathique, top",les clients ne peuvent pas voir vos realisations avant de vous choisir,"Un de vos clients sur Google signale que c'est les clients ne peuvent pas voir vos realisations avant de vous choisir. Un d'eux a meme ecrit : ""On croirait avoir en bouche des chips type Pringles"" C'est frustrant, ce qui vous fait perdre des clients face a des concurrents mieux visibles. La solution : une galerie photo de vos meilleurs travaux.",A contacter,,,,,,,
3,Restauration,Boulangerie,Paris,Su Pâtisserie Paris,"15 Rue Volta, 75003 Paris, France",06 14 88 44 44,,NON,NON,4.5,248,,"livraison, a emporter, sur place, petit-dej, click&collect",10,lundi: 11:30 – 20:00 | mardi: 11:30 – 20:00 | mercredi: Fermé | jeudi: 11:30 – 20:00 | vendredi: 11:30 – 20:00 | samedi: 11:00 – 20:30 | dimanche: 11:00 – 20:30,,"bakery, store",https://maps.google.com/?cid=17686584623242213935,"Cela faisait longtemps que j'avais envie de goûter leurs pâtisseries, j'aime beaucoup les pâtisseries japonaises.
Honnêtement, j'ai été un peu déçue en goûtant le gâteau aux fraises, qui était gros ma | J’ai demandé un modèle de Gateau précis on m’a dit que oui oui c’était réalisable je vous montre ce que j’ai eu . Ce n’est même pas symétrique la couleur n’est pas pareil ya un chiffre plus gros que l","accueil, qualite, delicieux",l'organisation des rendez-vous cree de l'attente,"Un de vos clients sur Google signale que c'est l'organisation des rendez-vous cree de l'attente. Un d'eux a meme ecrit : ""Cela faisait longtemps que j'avais envie de goûter leurs pâtisseries, j'aime beaucoup les pâtisseries japonaises"" C'est frustrant, ce qui frustre vos clients fideles. La solution : un systeme de reservation en ligne qui evite les embouteillages.",A contacter,,,,,,,
4,Beaute,Nail Art,Paris,Nail Art - Onglerie Paris 15,"3 Rue de l'Abbé Groult, 75015 Paris, France",06 58 47 04 13,,NON,NON,4.4,76,,,10,lundi: 10:00 – 20:00 | mardi: 10:00 – 20:00 | mercredi: 10:00 – 20:00 | jeudi: 10:00 – 20:00 | vendredi: 10:00 – 20:00 | samedi: 10:00 – 20:00 | dimanche: 10:00 – 20:00,,beauty_salon,https://maps.google.com/?cid=15521503582270463760,"Le résultat des ongles est excellent. Vraiment rien à dire. La nail tech Sylvie est adorable, par contre l’accueil et service client par la nail tech Zoe est terrible. Dès qu’on pose une question ou d","professionnel, rapide, propre",peu d'avis Google,"Vous n'avez que 5 avis sur Google. Vos concurrents en ont souvent 10x plus. Sans site web, vous etes invisible pour les gens qui cherchent votre activite.",A contacter,,,,,,,
5,Artisan,Menuisier,Paris,Tuxia Menuiserie,"18 Rue Coypel, 75013 Paris, France",06 62 17 55 07,,NON,NON,4.1,24,,,8,,,,https://maps.google.com/?cid=7408044196349494260,,"professionnel, qualite, excellent",peu d'avis Google,"Vous n'avez que 5 avis sur Google. Vos concurrents en ont souvent 10x plus. Sans site web, vous etes invisible pour les gens qui cherchent votre activite.",A contacter,,,,,,,
6,Auto,Garage,Paris,Garage Five,"52 Rue Petit, 75019 Paris, France",07 56 95 00 75,,NON,NON,3.8,10,,PMR,1,lundi: Ouvert 24h/24 | mardi: Ouvert 24h/24 | mercredi: Ouvert 24h/24 | jeudi: Ouvert 24h/24 | vendredi: Ouvert 24h/24 | samedi: Ouvert 24h/24 | dimanche: Ouvert 24h/24,,car_repair,https://maps.google.com/?cid=14347562015245842949,"Je déconseille fortement, raccroche au nez avant même que je termine ma phrase","rapide, efficace, qualite",peu d'avis Google,"Vous n'avez que 5 avis sur Google. Vos concurrents en ont souvent 10x plus. Sans site web, vous etes invisible pour les gens qui cherchent votre activite.",A contacter,,,,,,,
7,Auto,Garage,Paris,Garage Claude Porte Doree.,"4 Rue de l'Essai, 75005 Paris, France",07 80 99 32 94,,NON,NON,4.4,83,,PMR,6,lundi: 07:45 – 18:45 | mardi: 07:45 – 18:45 | mercredi: 07:45 – 18:45 | jeudi: 07:45 – 18:45 | vendredi: 07:45 – 18:45 | samedi: 09:00 – 17:00 | dimanche: Fermé,,"car_dealer, car_repair, store",https://maps.google.com/?cid=5882008457167517205,Un garage qui propose des prix plus qu’excessifs et qui invente des problèmes a ma voiture. Sûrement car je suis une femme. Passez votre chemin,"accueil, honnete, sympathique",les clients ne trouvent pas vos tarifs avant de vous contacter,"Un de vos clients sur Google signale que c'est les clients ne trouvent pas vos tarifs avant de vous contacter. Un d'eux a meme ecrit : ""Un garage qui propose des prix plus qu’excessifs et qui invente des problèmes a ma voiture"" C'est frustrant, ce qui fait fuir ceux qui veulent juste une idee du budget. La solution : une page tarifs claire qui pre-qualifie vos clients.",A contacter,,,,,,,
8,Commerce,Epicerie,Paris,L'Arc Épicerie - 7J7,"2 Rue des Acacias, 75017 Paris, France",06 37 96 29 18,,NON,NON,4.2,70,,"livraison, a emporter, PMR",10,lundi: 19:00 – 06:00 | mardi: 19:00 – 06:00 | mercredi: 19:00 – 06:00 | jeudi: 19:00 – 06:00 | vendredi: 19:00 – 06:00 | samedi: 19:00 – 06:00 | dimanche: 19:00 – 06:00,,"convenience_store, grocery_or_supermarket, store",https://maps.google.com/?cid=7804498305198402828,"Attention, ne vous fier pas au horaires de nuit... il est toujours fermé ! Il ne met pas a jour ses horaires, ou il ferme et part plus tôt.  Car moi j'ai lu 17-6h. Je me suis déplacé a 3h,et je me ret | Je me suis rendu à votre épicerie hier soir et c'était fermé. Inadmissible, sachant qu'il était 4h du matin et qu'il est écrit qu'elle ferme a 6h. J'ai fait 2h de trajets pour me rendre à la seule épi","excellent, accueil, qualite",vos horaires sont introuvables ou incorrects en ligne,"2 de vos clients sur Google se plaignent du meme probleme : vos horaires sont introuvables ou incorrects en ligne. Un d'eux a meme ecrit : ""Attention, ne vous fier pas au horaires de nuit"" C'est frustrant, et vos clients se deplacent pour rien. La solution : un site avec vos horaires toujours a jour.",A contacter,,,,,,,
9,Commerce,Epicerie,Paris,Diderot Supérette,"78 Bd Diderot, 75012 Paris, France",06 25 35 57 57,,NON,NON,3.6,21,,,10,lundi: 08:00 – 02:00 | mardi: 08:00 – 02:00 | mercredi: 08:00 – 02:00 | jeudi: 08:00 – 02:00 | vendredi: 08:00 – 02:00 | samedi: 08:00 – 02:00 | dimanche: 08:00 – 02:00,,"convenience_store, store",https://maps.google.com/?cid=1451099884459524318,"Ils ont perdu le colis qui avait été livré chez eux. Ils l'ont cherché 20 minutes puis nous ont dit de faire une réclamation à Chronopost. Tout ça, avec un ton hyper désagréable. À fuir. | C’est une catastrophe, nous avons plusieurs fois essayé de faire livrer nos colis ici, ils les ont À CHAQUE FOIS refusés (même pour des tous petits colis). Ne prenez surtout pas ce point relais.","accueil, sympathique, gentil",vos nouveaux clients ont du mal a vous trouver,"Un de vos clients sur Google signale que c'est vos nouveaux clients ont du mal a vous trouver. Un d'eux a meme ecrit : ""Ils l'ont cherché 20 minutes puis nous ont dit de faire une réclamation à Chronopost"" C'est frustrant, meme quand ils cherchent exactement ce que vous proposez. La solution : un site optimise pour apparaitre sur Google quand on cherche votre activite.",A contacter,,,,,,,
10,Commerce,Epicerie,Paris,Épicerie / Supermarché / Marché Malar /Alimentation Générale / Grocery shop / luggage storage paris / bagage,"2 ter Rue Malar, 75007 Paris, France",07 53 80 93 06,,NON,NON,3.0,17,,"livraison, click&collect",7,lundi: 11:00 – 00:30 | mardi: 09:30 – 00:30 | mercredi: 09:30 – 00:30 | jeudi: 09:30 – 00:30 | vendredi: 09:30 – 02:00 | samedi: 09:30 – 02:00 | dimanche: 09:30 – 00:30,,"convenience_store, grocery_or_supermarket, store, supermarket",https://maps.google.com/?cid=9547254188474252971,"Ouverts tard le soir, c’est clairement pratique quand tout le reste est fermé, surtout un soir comme la fête de la musique.
Les prix restent quand même assez élevés, et il y avait pas mal de monde.
Ma | 11,90euros le pack de 6 heineken.. rien à dire","top, accueil, gentil",vos horaires sont introuvables ou incorrects en ligne,"Un de vos clients sur Google signale que c'est vos horaires sont introuvables ou incorrects en ligne. Un d'eux a meme ecrit : ""Ouverts tard le soir, c’est clairement pratique quand tout le reste est fermé, surtout un soir comme la fête de la musique"" C'est frustrant, et vos clients se deplacent pour rien. La solution : un site avec vos horaires toujours a jour.",A contacter,,,,,,,
11,Commerce,Epicerie,Paris,SUPERETTE ALIMENTATION,"5 Rue de l'Amiral Roussin, 75015 Paris, France",06 56 55 55 69,,NON,NON,4.4,16,,livraison,10,lundi: 10:00 – 03:00 | mardi: 10:00 – 03:00 | mercredi: 10:00 – 03:00 | jeudi: 10:00 – 03:00 | vendredi: 10:00 – 03:00 | samedi: 10:00 – 03:00 | dimanche: 10:00 – 03:00,,"grocery_or_supermarket, store",https://maps.google.com/?cid=8001956164137501717,écrit ouvert alors que fermé,"accueil, disponible, propre",vos horaires sont introuvables ou incorrects en ligne,"Un de vos clients sur Google signale que c'est vos horaires sont introuvables ou incorrects en ligne. Un d'eux a meme ecrit : ""écrit ouvert alors que fermé"" C'est frustrant, et vos clients se deplacent pour rien. La solution : un site avec vos horaires toujours a jour.",A contacter,,,,,,,
12,Commerce,Epicerie,Paris,Market Paris Express,"20 Rue Dauphine, 75006 Paris, France",06 00 00 00 00,,NON,NON,3.9,35,,,10,lundi: 14:30 – 01:30 | mardi: 14:30 – 01:30 | mercredi: 14:30 – 01:30 | jeudi: 14:30 – 01:30 | vendredi: 14:30 – 02:00 | samedi: 14:30 – 02:00 | dimanche: 14:30 – 01:30,,"grocery_or_supermarket, store",https://maps.google.com/?cid=5672901094692570359,"Comportement inacceptable du vendeur : ton condescendant et remarques déplacées. Rien à redire sur le produit, mais l’attitude ne donne absolument pas envie de revenir.","accueil, chaleureux, sympathique",peu d'avis Google,"Vous n'avez que 5 avis sur Google. Vos concurrents en ont souvent 10x plus. Sans site web, vous etes invisible pour les gens qui cherchent votre activite.",A contacter,,,,,,,
13,Commerce,Epicerie,Paris,Shop Market - Épicerie De Nuit,"3 places de la, 75014 Paris, France",07 62 54 03 98,,NON,NON,3.5,102,,PMR,10,lundi: Ouvert 24h/24 | mardi: Ouvert 24h/24 | mercredi: Ouvert 24h/24 | jeudi: Ouvert 24h/24 | vendredi: Ouvert 24h/24 | samedi: Ouvert 24h/24 | dimanche: Ouvert 24h/24,,"grocery_or_supermarket, store",https://maps.google.com/?cid=6524783184983094903,"Mytho 2h54 fermé, dommage direction Didot express, la concurrence | Ne respecte pas les 24h/24 jamais ouvert de nuit... clodos aux alentours ça craint de folie...je ne recommande pas du tout et JAMAIS... N'est pas ouvert c'est faux... N'y allez pas vous allez être déç","professionnel, frais",vos horaires sont introuvables ou incorrects en ligne,"2 de vos clients sur Google se plaignent du meme probleme : vos horaires sont introuvables ou incorrects en ligne. Un d'eux a meme ecrit : ""Mytho 2h54 fermé, dommage direction Didot express, la concurrence"" C'est frustrant, et vos clients se deplacent pour rien. La solution : un site avec vos horaires toujours a jour.",A contacter,,,,,,,
14,Commerce,Epicerie,Paris,Mini Market,"94 Av. Philippe Auguste, 75011 Paris, France",06 73 24 46 51,,NON,NON,4.1,44,,livraison,3,lundi: 15:15 – 06:00 | mardi: 15:15 – 06:00 | mercredi: 15:15 – 06:00 | jeudi: 15:15 – 06:00 | vendredi: 15:15 – 07:00 | samedi: 15:15 – 07:00 | dimanche: 15:15 – 06:00,,"grocery_or_supermarket, store",https://maps.google.com/?cid=9465595604282401384,"Afficher ouvert jusqu'à 6h du matin ce dimanche, je me suis déplacé et j'ai trouvé fermé a 22h20 | Pour dépanner et  faciliter la vie de la population ce lieu est très utile .",,vos horaires sont introuvables ou incorrects en ligne,"2 de vos clients sur Google se plaignent du meme probleme : vos horaires sont introuvables ou incorrects en ligne. Un d'eux a meme ecrit : ""J’y suis passée un jeudi soir et c’était fermé alors que c’est écrit ouvert"" C'est frustrant, et vos clients se deplacent pour rien. La solution : un site avec vos horaires toujours a jour.",A contacter,,,,,,,
15,Commerce,Epicerie,Paris,Easy Market,"3 Rue Belidor, 75017 Paris, France",06 19 39 13 94,,NON,NON,4.4,80,,livraison,9,lundi: 15:00 – 02:30 | mardi: Fermé | mercredi: 15:00 – 02:30 | jeudi: 15:00 – 02:30 | vendredi: 15:00 – 02:30 | samedi: 15:00 – 02:30 | dimanche: 15:00 – 02:30,,"convenience_store, grocery_or_supermarket, store, supermarket",https://maps.google.com/?cid=9282692107883811473,,"accueil, professionnel, chaleureux",peu d'avis Google,"Vous n'avez que 5 avis sur Google. Vos concurrents en ont souvent 10x plus. Sans site web, vous etes invisible pour les gens qui cherchent votre activite.",A contacter,,,,,,,
16,Commerce,Epicerie,Paris,Super Market,"114 Bd du Montparnasse, 75014 Paris, France",07 46 37 58 22,,NON,NON,4.2,29,,"livraison, PMR",10,lundi: 12:30 – 03:00 | mardi: 12:30 – 03:00 | mercredi: 12:30 – 03:00 | jeudi: 12:30 – 03:00 | vendredi: 12:30 – 03:00 | samedi: 12:30 – 03:00 | dimanche: 12:30 – 03:00,,"convenience_store, store",https://maps.google.com/?cid=10250846742640936781,"J ai achete une petite bouteille d’eau cristaline à 1,50€. Je m apprête à la boire et je me rends compte que la couleur de l eau tire vers le vert ! La bouteille n est pas fermée et il semble y avoir  | Le proprietaire a changé. Une catastrophe. Moi j ai même peur d y aller. Le soir, ca traine devant la boutique, je rentre acheter une sauce tomate, le gars est au telephone et ne daigne meme pas lever","accueil, sympathique, propre",difficile a joindre par telephone,"Un de vos clients sur Google signale que c'est difficile a joindre par telephone. Un d'eux a meme ecrit : ""Le soir, ca traine devant la boutique, je rentre acheter une sauce tomate, le gars est au telephone et ne daigne meme pas lever le"" C'est frustrant, surtout quand on a besoin d'un renseignement ou d'un devis urgent. La solution : un formulaire de contact en ligne disponible 24h/24.",A contacter,,,,,,,
17,Restauration,Pizzeria,Marseille,La loge snack pizzeria spécialité tunisienne,"22 Rue de la Loge, 13002 Marseille, France",07 53 72 67 62,,NON,NON,4.5,393,,"livraison, a emporter, sur place, vegetarien, dejeuner, diner",10,lundi: 10:00 – 02:00 | mardi: 10:00 – 02:00 | mercredi: 10:00 – 02:00 | jeudi: 10:00 – 02:00 | vendredi: 10:00 – 02:00 | samedi: 10:00 – 02:00 | dimanche: 10:00 – 02:00,,restaurant,https://maps.google.com/?cid=3488427714396128038,,"accueil, rapide, delicieux",peu d'avis Google,"Vous n'avez que 5 avis sur Google. Vos concurrents en ont souvent 10x plus. Sans site web, vous etes invisible pour les gens qui cherchent votre activite.",A contacter,,,,,,,
18,Restauration,Pizzeria,Marseille,O'BAR À PIZZA,"98 Cr Julien, 13006 Marseille, France",07 63 73 83 23,,NON,NON,4.0,103,,"livraison, a emporter, sur place, click&collect, PMR",10,lundi: 12:00 – 02:00 | mardi: 12:00 – 02:00 | mercredi: 12:00 – 02:00 | jeudi: 12:00 – 02:00 | vendredi: 12:00 – 02:00 | samedi: 12:00 – 02:00 | dimanche: 12:00 – 02:00,,restaurant,https://maps.google.com/?cid=6339798940754835768,"Nous avons commandé deux pizzas : une fromage 10, 50 et une vege à 13,50. Une fois la commande servi, on a trouvé ça bizarre que la vege soit sans fromage dessus avec des légumes pas cuits. Un peu che | La pizza m’a donné la pâteuse j’avais l’impression d’avoir tiré sur un pétard. Aucun aliment frais, rien de bon. C’est une folie que cet établissement soit encore ouvert dans Marseille. Point positif:","excellent, qualite, rapide",vos horaires sont introuvables ou incorrects en ligne,"Un de vos clients sur Google signale que c'est vos horaires sont introuvables ou incorrects en ligne. Un d'eux a meme ecrit : ""C’est une folie que cet établissement soit encore ouvert dans Marseille"" C'est frustrant, et vos clients se deplacent pour rien. La solution : un site avec vos horaires toujours a jour.",A contacter,,,,,,,
19,Restauration,Pizzeria,Marseille,Pizza Au Feu De Bois,"130 Chem. de la Madrague-Ville, 13015 Marseille, France",07 84 74 55 23,,NON,NON,4.1,73,,"a emporter, sur place",10,lundi: Ouvert 24h/24 | mardi: Ouvert 24h/24 | mercredi: Ouvert 24h/24 | jeudi: Ouvert 24h/24 | vendredi: Ouvert 24h/24 | samedi: Ouvert 24h/24 | dimanche: Ouvert 24h/24,,restaurant,https://maps.google.com/?cid=17915048663552175015,"Honnêtement, grosse déception. 2h d'attente pour se faire livrer, on a attendu devant la plage et le livreur a mis une éternité à arriver. La pizza était très sèche, avec une pâte qui représentait 95%","rapide, qualite, efficace",les clients ne peuvent pas voir vos realisations avant de vous choisir,"Un de vos clients sur Google signale que c'est les clients ne peuvent pas voir vos realisations avant de vous choisir. Un d'eux a meme ecrit : ""Expérience à revoir"" C'est frustrant, ce qui vous fait perdre des clients face a des concurrents mieux visibles. La solution : une galerie photo de vos meilleurs travaux.",A contacter,,,,,,,
20,Restauration,Pizzeria,Marseille,Pizzeria Di Venezia,"12 Rue Pythéas, 13001 Marseille, France",06 26 18 47 03,,NON,NON,4.6,276,modere,"a emporter, sur place, petit-dej, dejeuner, diner, PMR",10,lundi: 12:00 – 16:00 | mardi: 12:00 – 16:00 | mercredi: 12:00 – 16:00 | jeudi: 12:00 – 16:00 | vendredi: 12:00 – 16:00 | samedi: 12:00 – 15:10 | dimanche: Fermé,,restaurant,https://maps.google.com/?cid=13678158251716794679,"Un cadre chaleureux et un accueil au top, on se sent bien ici. Si la pizza au feu de bois est une belle réussite, les pâtes ont été une vraie déception : trop cuites et accompagnées d'une sauce qui ma","qualite, accueil, chaleureux",peu d'avis Google,"Vous n'avez que 5 avis sur Google. Vos concurrents en ont souvent 10x plus. Sans site web, vous etes invisible pour les gens qui cherchent votre activite.",A contacter,,,,,,,
21,Restauration,Kebab,Marseille,Welcome Istambul kebab,"22 Rue de la République, 13001 Marseille, France",06 95 05 82 51,,NON,NON,4.4,76,,"livraison, a emporter, sur place, dejeuner, diner",10,lundi: 11:00 – 02:00 | mardi: 11:00 – 02:30 | mercredi: Fermé | jeudi: 11:00 – 02:30 | vendredi: 11:00 – 02:30 | samedi: 11:00 – 02:30 | dimanche: 11:00 – 02:30,,restaurant,https://maps.google.com/?cid=15032418521560986003,,"qualite, propre, excellent",peu d'avis Google,"Vous n'avez que 5 avis sur Google. Vos concurrents en ont souvent 10x plus. Sans site web, vous etes invisible pour les gens qui cherchent votre activite.",A contacter,,,,,,,
22,Restauration,Kebab,Marseille,ISTANBUL GRILL KEBAB - VIEUX PORT,"132 Quai du Port, 13002 Marseille, France",07 58 46 27 88,,NON,NON,4.3,254,,"livraison, a emporter, reservable en ligne, sur place, vegetarien, petit-dej, dejeuner, diner, PMR",10,lundi: 11:00 – 00:00 | mardi: 11:00 – 00:00 | mercredi: 11:00 – 00:00 | jeudi: 11:00 – 00:00 | vendredi: 11:00 – 00:00 | samedi: 11:00 – 00:00 | dimanche: 11:00 – 00:00,,"meal_takeaway, restaurant",https://maps.google.com/?cid=16178878225420523062,"The food was ok. Good portion, but lamb chops was from shoulder, not a good meat. Waitress was very good, polite and attentive. But the Boss on the register was crook and cheap thieve. He took my 2 €u | Moyen !

Franchement, c’était sans plus. On avait pris un tacos, c’était correct mais fait un peu vite fait, rien d’exceptionnel.
Le service était assez long aussi. Bref, pas mauvais, mais pas de quoi","accueil, qualite, delicieux",les clients ne peuvent pas voir vos realisations avant de vous choisir,"2 de vos clients sur Google se plaignent du meme probleme : les clients ne peuvent pas voir vos realisations avant de vous choisir. Un d'eux a meme ecrit : ""Bon… la photo parle d’elle-même"" C'est frustrant, ce qui vous fait perdre des clients face a des concurrents mieux visibles. La solution : une galerie photo de vos meilleurs travaux.",A contacter,,,,,,,
23,Restauration,Kebab,Marseille,ISTANBUL GRILL KEBAB,"20 Cr Belsunce, 13001 Marseille, France",06 66 78 31 23,,NON,NON,4.1,170,,"livraison, a emporter, sur place, dejeuner, diner",10,lundi: 09:00 – 00:00 | mardi: 09:00 – 00:00 | mercredi: 09:00 – 00:00 | jeudi: 09:00 – 00:00 | vendredi: 09:00 – 00:00 | samedi: 09:00 – 00:00 | dimanche: Fermé,,restaurant,https://maps.google.com/?cid=4034744606315844573,"Kebab bon mais maigre et portion de frites maigre, je me suis rendu compte après avoir pris la photo mais ils ont laissé le papier sous le sandwich. Franchement n’y allez pas pour vous remplir le vent | HORRIBLE ! Immangeable, on était 5 avec chacun un plat/menu différent. Les frites congelées et infectes. Le plat iskender c'est de la sauce tomate concentrée avec un petit suisse étalé. Les sandwichs ","rapide, accueil, qualite",les clients ne peuvent pas voir vos realisations avant de vous choisir,"Un de vos clients sur Google signale que c'est les clients ne peuvent pas voir vos realisations avant de vous choisir. Un d'eux a meme ecrit : ""Kebab bon mais maigre et portion de frites maigre, je me suis rendu compte après avoir pris la photo mais ils ont laissé le papier"" C'est frustrant, ce qui vous fait perdre des clients face a des concurrents mieux visibles. La solution : une galerie photo de vos meilleurs travaux.",A contacter,,,,,,,
24,Restauration,Kebab,Marseille,Kebab Berliner - Crousty bols,"24 Rue Coutellerie, 13002 Marseille, France",06 51 24 03 42,,NON,NON,3.4,74,,"livraison, a emporter, sur place, dejeuner, diner, click&collect",10,lundi: 11:00 – 00:30 | mardi: 11:00 – 00:30 | mercredi: 11:00 – 00:30 | jeudi: 11:00 – 00:30 | vendredi: 11:00 – 03:00 | samedi: 11:00 – 03:00 | dimanche: 11:00 – 00:30,,restaurant,https://maps.google.com/?cid=4493719328510554287,"Le tacos il est sec hein.
Cela représente bien l’expérience gustative, on les remercie car cela nous a permis de travailler comme il faut la mâchoire qui a beaucoup souffert durant la dégustation. Tou | Je suis très déçu par mon expérience chez Kebab Berliner Osid. Les produits étaient froids et de mauvaise qualité, et en plus, j’ai reçu seulement deux sandwiches au lieu de quatre. Ils n’ont pas voul","rapide, savoureux, frais",les clients ne peuvent pas voir vos realisations avant de vous choisir,"Un de vos clients sur Google signale que c'est les clients ne peuvent pas voir vos realisations avant de vous choisir. Un d'eux a meme ecrit : ""Obligé de mettre une étoile parce que je peux pas mettre zéro, j’ai commandé sur Deliveroo pour ne pas avoir à me déplacer"" C'est frustrant, ce qui vous fait perdre des clients face a des concurrents mieux visibles. La solution : une galerie photo de vos meilleurs travaux.",A contacter,,,,,,,
25,Restauration,Kebab,Marseille,Le Stand By,"5 Rue Louis Maurel, 13006 Marseille, France",06 58 73 09 87,,NON,NON,4.3,96,,"livraison, a emporter, sur place, petit-dej, dejeuner, diner",10,lundi: 10:30 – 00:00 | mardi: 10:30 – 00:00 | mercredi: 10:30 – 00:00 | jeudi: 10:30 – 00:00 | vendredi: 10:30 – 00:00 | samedi: 10:30 – 00:00 | dimanche: 10:30 – 00:00,,restaurant,https://maps.google.com/?cid=9644675449904253600,,"accueil, propre, gentil",peu d'avis Google,"Vous n'avez que 5 avis sur Google. Vos concurrents en ont souvent 10x plus. Sans site web, vous etes invisible pour les gens qui cherchent votre activite.",A contacter,,,,,,,
